{
  "task_id": "T-0002",
  "source_run": "T-0002#run-01",
  "change_target": "process",
  "failure_root_cause": "Acceptance criteria were too qualitative and caused review ambiguity.",
  "fix_type": "process",
  "proposed_change": "Require at least one measurable threshold in each acceptance check.",
  "expected_impact": "Reduced reviewer disagreement and lower rework count.",
  "owner": "planner-pm",
  "priority": "p1"
}
